{
  "schemaVersion": 1,
  "contentVersion": "cardio-0.1",
  "status": "draft_unreviewed",
  "disclaimer": "검수 전 모형 · 출처 본문 확인, 전문 의료 검수 전. 실제 진단·치료에 사용하지 마세요.",
  "review": null,
  "sources": [
    {
      "id": "nhlbi-anatomy",
      "title": "What the Heart Looks Like",
      "publisher": "NHLBI / NIH",
      "url": "https://www.nhlbi.nih.gov/health/heart/anatomy",
      "updatedAt": "2022-03-24",
      "section": "Heart chambers; Heart tissue",
      "claims": [
        "네 방의 심방/심실 구분",
        "몸/폐에서 심방으로, 심방에서 심실로",
        "심장근육의 수축"
      ],
      "checkedAt": "2026-10-11"
    },
    {
      "id": "nhlbi-flow",
      "title": "How Blood Flows through the Heart",
      "publisher": "NHLBI / NIH",
      "url": "https://www.nhlbi.nih.gov/health/heart/blood-flow",
      "updatedAt": "2025-06-25",
      "section": "Heart valves; Adding oxygen to blood; Supplying oxygen to the heart’s muscle",
      "claims": [
        "판막과 역류 방지",
        "폐/몸으로 이어지는 순환",
        "대동맥에서 갈라지는 관상동맥의 심근 공급"
      ],
      "checkedAt": "2026-10-11"
    },
    {
      "id": "nhlbi-beats",
      "title": "How the Heart Beats",
      "publisher": "NHLBI / NIH",
      "url": "https://www.nhlbi.nih.gov/health/heart/heart-beats",
      "updatedAt": "2025-06-25",
      "section": "Electrical activity",
      "claims": [
        "동방결절→심방→방실결절 지연→심실로의 전도",
        "전기 신호와 혈액 이동은 다른 현상"
      ],
      "checkedAt": "2026-10-11"
    },
    {
      "id": "nhlbi-arteries",
      "title": "What Is Atherosclerosis?",
      "publisher": "NHLBI / NIH",
      "url": "https://www.nhlbi.nih.gov/health/atherosclerosis",
      "updatedAt": "2024-10-28",
      "section": "Plaque builds up; arteries narrow",
      "claims": [
        "좁아진 동맥에서 조직 공급이 줄 수 있음",
        "게임 통로 수치는 실제 혈류 계산이 아님"
      ],
      "checkedAt": "2026-10-11"
    },
    {
      "id": "nhlbi-measure",
      "title": "High Blood Pressure Diagnosis",
      "publisher": "NHLBI / NIH",
      "url": "https://www.nhlbi.nih.gov/health/high-blood-pressure/diagnosis",
      "updatedAt": "2025-06-26",
      "section": "Getting ready for a blood pressure measurement; Confirming high blood pressure",
      "claims": [
        "측정 준비/긴장/도구가 기록에 영향을 줄 수 있음",
        "임상 진단은 한 번의 가상 수치로 정하지 않음"
      ],
      "checkedAt": "2026-10-11"
    }
  ],
  "concepts": [
    {
      "id": "circulation",
      "title": "이어지는 순환",
      "text": "혈액은 몸과 폐를 거쳐 심장으로 돌아오는 경로를 이룬다.",
      "prerequisites": [],
      "sources": [
        "nhlbi-flow"
      ],
      "limitations": "공간·크기·시간을 줄인 교육용 모형이며 실제 해부 도해나 개인의 상태를 대신하지 않는다."
    },
    {
      "id": "chambers",
      "title": "심방과 심실",
      "text": "심방은 들어오는 혈액을 받고 심실은 밖으로 내보낸다. 오른쪽/왼쪽은 몸 주인의 기준이다.",
      "prerequisites": [
        "circulation"
      ],
      "sources": [
        "nhlbi-anatomy"
      ],
      "limitations": "공간·크기·시간을 줄인 교육용 모형이며 실제 해부 도해나 개인의 상태를 대신하지 않는다."
    },
    {
      "id": "valves",
      "title": "방향을 지키는 판막",
      "text": "판막은 혈액이 거꾸로 흐르는 것을 막는 데 관여한다. 모형 문을 고치는 행동은 실제 치료가 아니다.",
      "prerequisites": [
        "chambers"
      ],
      "sources": [
        "nhlbi-flow"
      ],
      "limitations": "공간·크기·시간을 줄인 교육용 모형이며 실제 해부 도해나 개인의 상태를 대신하지 않는다."
    },
    {
      "id": "two-circuits",
      "title": "폐와 몸의 연결",
      "text": "몸→우심방→우심실→폐→좌심방→좌심실→몸으로 경로가 이어진다.",
      "prerequisites": [
        "chambers",
        "valves"
      ],
      "sources": [
        "nhlbi-flow"
      ],
      "limitations": "공간·크기·시간을 줄인 교육용 모형이며 실제 해부 도해나 개인의 상태를 대신하지 않는다."
    },
    {
      "id": "signal",
      "title": "박동과 전기 신호",
      "text": "동방결절에서 시작한 신호가 심방과 방실결절을 거쳐 심실의 수축으로 이어진다.",
      "prerequisites": [
        "chambers"
      ],
      "sources": [
        "nhlbi-beats"
      ],
      "limitations": "전도계의 세부 다발·분지와 실제 시간 간격은 생략한다. 신호 표식은 혈액 자체가 아니다."
    },
    {
      "id": "coronary",
      "title": "펌프의 공급",
      "text": "심장근육도 산소와 영양 공급이 필요하며 관상동맥은 대동맥에서 갈라져 심장에 혈액을 공급한다.",
      "prerequisites": [
        "two-circuits"
      ],
      "sources": [
        "nhlbi-flow"
      ],
      "limitations": "공간·크기·시간을 줄인 교육용 모형이며 실제 해부 도해나 개인의 상태를 대신하지 않는다."
    },
    {
      "id": "comparison",
      "title": "한 조건씩 비교",
      "text": "좁아진 동맥은 공급을 줄일 수 있다. 모형의 두 조건은 다른 변수를 같게 두고 비교한다.",
      "prerequisites": [
        "coronary"
      ],
      "sources": [
        "nhlbi-arteries"
      ],
      "limitations": "표식 개수는 게임 수치다. 실제 혈류에는 압력차·점도·탄성·조절 등도 관여하며 게임 결과로 질환이나 개인 상태를 계산하지 않는다."
    },
    {
      "id": "records",
      "title": "기록의 조건",
      "text": "기록의 시간·준비·도구 등을 확인해야 한다. 가상 기록 하나로 사람의 질환을 단정하지 않는다.",
      "prerequisites": [
        "comparison"
      ],
      "sources": [
        "nhlbi-measure"
      ],
      "limitations": "환자 기록이나 혈압 기준을 사용하지 않는다. 가상의 게임 표식 수만 비교하며 진단·치료 권고를 제공하지 않는다."
    },
    {
      "id": "reporting",
      "title": "관찰과 설명의 연결",
      "text": "모형 관찰을 기전 설명과 연결하고 실제 인체에 적용할 때의 한계와 출처를 함께 밝힌다.",
      "prerequisites": [
        "two-circuits",
        "records"
      ],
      "sources": [
        "nhlbi-flow"
      ],
      "limitations": "공간·크기·시간을 줄인 교육용 모형이며 실제 해부 도해나 개인의 상태를 대신하지 않는다."
    },
    {
      "id": "synthesis",
      "title": "첫 기획의 근거",
      "text": "구조·흐름·신호·공급을 구분해 독자 질문에 맞는 근거와 한계를 고른다.",
      "prerequisites": [
        "reporting",
        "signal",
        "coronary"
      ],
      "sources": [
        "nhlbi-anatomy",
        "nhlbi-flow",
        "nhlbi-beats"
      ],
      "limitations": "공간·크기·시간을 줄인 교육용 모형이며 실제 해부 도해나 개인의 상태를 대신하지 않는다."
    }
  ],
  "quests": [
    {
      "id": "Q001",
      "title": "사라진 혈액 배달표",
      "question": "심장은 피를 보내기만 하나요?",
      "offer": "고리의 배달 길이 끊겼어요. 표식이 나갔다 돌아오도록 길 세 곳을 이어 주세요.",
      "region": "heart",
      "conceptIds": [
        "circulation"
      ],
      "observations": [
        {
          "id": "heart-out",
          "title": "나가는 표식",
          "text": "심장에서 나가는 표식이 모형 고리로 들어갔다.",
          "conceptId": "circulation",
          "sources": [
            "nhlbi-flow"
          ]
        },
        {
          "id": "heart-in",
          "title": "돌아오는 표식",
          "text": "고리를 지난 표식이 돌아오는 입구에 도착했다.",
          "conceptId": "circulation",
          "sources": [
            "nhlbi-flow"
          ]
        }
      ],
      "tasks": [
        {
          "id": "apply",
          "kind": "flow",
          "title": "배달 모형 복구",
          "instruction": "고리의 배달 길이 끊겼어요. 표식이 나갔다 돌아오도록 길 세 곳을 이어 주세요.",
          "choices": [
            {
              "id": "es",
              "label": "┌ 아래·오른쪽",
              "explanation": "꺾인 길"
            },
            {
              "id": "sw",
              "label": "┐ 아래·왼쪽",
              "explanation": "꺾인 길"
            },
            {
              "id": "wn",
              "label": "┘ 위·왼쪽",
              "explanation": "꺾인 길"
            },
            {
              "id": "ne",
              "label": "└ 위·오른쪽",
              "explanation": "꺾인 길"
            },
            {
              "id": "ew",
              "label": "─ 좌우",
              "explanation": "곧은 길"
            },
            {
              "id": "ns",
              "label": "│ 위아래",
              "explanation": "곧은 길"
            }
          ],
          "slots": [
            {
              "id": "slot-0",
              "label": "첫 꺾임",
              "answer": [
                "ne"
              ]
            },
            {
              "id": "slot-1",
              "label": "가운데 길",
              "answer": [
                "ew"
              ]
            },
            {
              "id": "slot-2",
              "label": "마지막 꺾임",
              "answer": [
                "wn"
              ]
            }
          ],
          "hints": [
            "표식이 어디서 와서 어디로 가는지 먼저 보세요. 색만 보지 말고 이름과 화살표를 확인해요.",
            "관찰 카드와 모형 안내를 다시 보세요. 끊기지 않은 연결이 출발과 귀환을 이어 줬다."
          ],
          "feedback": "끊기지 않은 연결이 출발과 귀환을 이어 줬다.",
          "evidenceId": "applied",
          "scene": {
            "nodes": [
              {
                "id": "start",
                "label": "시작 표식",
                "x": 32,
                "y": 56
              },
              {
                "id": "slot-0",
                "label": "첫 꺾임",
                "x": 32,
                "y": 140
              },
              {
                "id": "slot-1",
                "label": "가운데 길",
                "x": 160,
                "y": 140
              },
              {
                "id": "slot-2",
                "label": "마지막 꺾임",
                "x": 288,
                "y": 140
              },
              {
                "id": "end",
                "label": "도착 표식",
                "x": 288,
                "y": 56
              }
            ],
            "links": [
              [
                "start",
                "slot-0"
              ],
              [
                "slot-0",
                "slot-1"
              ],
              [
                "slot-1",
                "slot-2"
              ],
              [
                "slot-2",
                "end"
              ]
            ]
          },
          "demonstration": "시연을 보면 첫 배치는 연결되지만, 새 배치 두 곳은 직접 적용해야 기사를 쓸 수 있어요.",
          "baseline": null
        },
        {
          "id": "transfer",
          "kind": "flow",
          "title": "새 배치 취재",
          "instruction": "배치와 출발 위치가 바뀌었어요. 같은 원리가 이어지는지 직접 시험해요.",
          "choices": [
            {
              "id": "es",
              "label": "┌ 아래·오른쪽",
              "explanation": "꺾인 길"
            },
            {
              "id": "sw",
              "label": "┐ 아래·왼쪽",
              "explanation": "꺾인 길"
            },
            {
              "id": "wn",
              "label": "┘ 위·왼쪽",
              "explanation": "꺾인 길"
            },
            {
              "id": "ne",
              "label": "└ 위·오른쪽",
              "explanation": "꺾인 길"
            },
            {
              "id": "ew",
              "label": "─ 좌우",